{
    "$schema": "https://json-schema.org/draft/2020-12/schema",
    "$id": "https://figaro.org/schemas/clause-spec.json",
    "title": "Figaro Clause Spec (Layer A)",
    "description": "The canonical shape of a Figaro clause specification — the off-chain JSON a clause author writes, pins to IPFS, and registers in ClauseRegistry. A clause is one term or condition of an agreement, published once, that anyone can compose. The spec has two halves either side of the UI/protocol crease: the TOP LEVEL is the protocol half (identity, registration, and the content fields that become clauses of signed agreements) — its reference parser is `parseClauseSpec` (sdk/src/clauses/spec.ts); `block` is the UI half (instructions to frontends, organized into phase sections by reader: design / checkout / runtime) — its reference parser is the frontend's `parseBlockBinding` (frontend/lib/shared/clauseBlockBinding.ts). Nothing in `block` is ever read on-chain. A conformance test (sdk/tests/clauses/schema-conformance.test.ts) keeps schema and parsers in lockstep. Validate your clause against this before registering it — a clause that does not conform is not surfaced by conforming frontends (resolved-empty = absence, never an error). THE STANDARD: express every attribute explicitly — zero, empty, or null, never absent (the repo's own clause corpus complies, enforced by test); consumers treat an absent attribute as its empty value, so a sparser spec still surfaces. The schema is OPEN (additionalProperties allowed at every level): unknown fields are tolerated and ignored, so the format can grow by versioning without rejecting older clauses.",
    "type": "object",
    "required": ["clauseId", "version", "title", "description", "fields"],
    "additionalProperties": true,
    "properties": {
        "clauseId": {
            "type": "string",
            "minLength": 1,
            "description": "Human-readable clause name, a presentation field inside the document. The on-chain identity is the clause key, keccak256 of the spec's pinned canonical bytes; the name reaches it only as bytes like every other field, so two specs with one name are two clauses."
        },
        "version": { "type": "integer", "minimum": 0, "description": "Clause version — an integer lineage counter a reader sees, never semver and never part of the identity: a changed spec is a new key." },
        "title": { "type": "string", "minLength": 1 },
        "description": { "type": "string" },
        "fields": {
            "type": "array",
            "items": { "$ref": "#/$defs/field" },
            "description": "The clause's content fields — the terms-and-conditions blanks. Filled in for a transaction, they become one CLAUSE of the signed agreement (a merkle leaf under the on-chain checkoutHash). This is the committed content: stage 0. WHO fills each blank is declared by the block phase sections' `fills` lists; any field named in no list is the buyer's, authored at checkout (the default — always derived as the complement, never stored)."
        },
        "stages": {
            "type": "object",
            "description": "Runtime-evidence field shapes, keyed by stage number (uint8, matching AttestationCoordinator's stage). Stage 0 IS the committed content and is declared by `fields` — declare entries here only for stages ≥ 1: the coordination attestations filed during execution against the committed term (a measured-grams record, a temperature reading, a detected proximity band). Any composed clause declaring a stage surfaces a repeatable witness capability for it, offered to both parties, with zero per-clause code. Express as {} when the clause declares no runtime-evidence stages.",
            "patternProperties": { "^[0-9]+$": { "type": "array", "items": { "$ref": "#/$defs/field" } } }
        },
        "block": { "$ref": "#/$defs/block" }
    },
    "$defs": {
        "fieldProps": {
            "type": "object",
            "additionalProperties": true,
            "properties": {
                "name": { "type": "string", "minLength": 1 },
                "type": { "enum": ["string", "integer", "bigint", "boolean", "enum", "array", "object"] },
                "required": { "type": "boolean" },
                "description": { "type": "string" },
                "label": { "type": "string", "description": "Cosmetic display label (Layer-A only; nothing on-chain reads it)." },
                "disposition": { "enum": ["public", "private"], "description": "The public/private disposition of this field's committed value — the clause-spec side of the data seam. \"public\" (the default when absent): coordination commons, learnable free, published plaintext. \"private\": paid-edge data, published only behind the fingerprint (encrypted IPFS / content-withheld clause). The chain carries only the clause data HASH either way; disposition governs publication and per-field grain policy (see figaro-geolocation)." },
                "default": {
                    "type": ["string", "number", "boolean", "array"],
                    "description": "Build/UI default (composition metadata; the ABI encoder ignores it). Shape must match the field type."
                },
                "format": { "type": "string", "minLength": 1, "description": "string only. An OPEN axis: any non-empty string is a valid declaration. Validators enforce the formats they know (bytes32-hex, address-hex, bytes-hex, iso-datetime) and treat the rest as plain strings; frontends may map known formats to richer inputs (e.g. geohash)." },
                "formatFromField": { "type": "string", "minLength": 1, "description": "string only. VALUE-DRIVEN input format: name a SIBLING field whose committed VALUE is the format key, instead of the static `format`. Lets a field's richer input follow an open, per-composition standard axis (figaro-geolocation's origin/destination declare formatFromField:\"geocodeStandard\" — the geohash picker + grain cap render when the committed standard is geohash, degrading to plain text otherwise). Resolved as values[formatFromField] ?? sibling default ?? format." },
                "minLength": { "type": "integer", "description": "string only." },
                "maxLength": { "type": "integer", "description": "string only." },
                "pattern": { "type": "string", "maxLength": 256, "description": "string only. A regex written in the portable core: printable ASCII; literals, '.', classes, groups '(...)' and '(?:...)', \\d \\D \\w \\W \\s \\S, escaped punctuation, ^ $ \\b \\B, alternation, and the quantifiers * + ? {n} {n,} {n,m} with counts up to 64, each optionally lazy. No lookaround, backreference, named group, inline flag, possessive quantifier, Unicode class, nested class or letter escape. A patterned field's value is printable ASCII." },
                "min": { "type": ["number", "string"], "description": "integer (number) or bigint (decimal string)." },
                "max": { "type": ["number", "string"], "description": "integer (number) or bigint (decimal string)." },
                "values": { "type": "array", "items": { "type": "string" }, "description": "enum only — the ordered value codes." },
                "sentinel": { "type": "string", "description": "enum only — an ABI position-as-index placeholder, never a valid input." },
                "valueLabels": { "type": "object", "additionalProperties": { "type": "string" }, "description": "enum only — cosmetic per-value labels." },
                "items": { "$ref": "#/$defs/itemField", "description": "array only — the element field spec (its name/required are injected, so omit them)." },
                "minItems": { "type": "integer", "description": "array only." },
                "maxItems": { "type": "integer", "description": "array only." },
                "fields": { "type": "array", "items": { "$ref": "#/$defs/field" }, "description": "object only — the nested (named) field specs." }
            },
            "allOf": [
                { "if": { "properties": { "type": { "const": "enum" } } }, "then": { "required": ["values"] } },
                { "if": { "properties": { "type": { "const": "array" } } }, "then": { "required": ["items"] } },
                { "if": { "properties": { "type": { "const": "object" } } }, "then": { "required": ["fields"] } }
            ]
        },
        "field": {
            "description": "A named field — top-level, stage-override, or object property. Requires name + type + required.",
            "allOf": [{ "$ref": "#/$defs/fieldProps" }, { "required": ["name", "type", "required"] }]
        },
        "itemField": {
            "description": "An array ELEMENT spec. The parser injects name + required, so only type is required here.",
            "allOf": [{ "$ref": "#/$defs/fieldProps" }, { "required": ["type"] }]
        },
        "block": {
            "type": "object",
            "description": "The UI half of the spec — instructions to frontends about how the clause presents and composes, organized into PHASE SECTIONS, each named for its reader: `design` (the designer's canvas/drawer), `checkout` (the checkout fold), `runtime` (the capability rail). Nothing on-chain reads any of it; any frontend could present the same clause differently. An attribute read in two phases is declared in the section of its FIRST reader. The one verb `fills` recurs across sections and always means the same thing: the content fields (by name) whose values that phase's actor authors; the buyer owns every content field named in no fills list.",
            "required": ["design"],
            "additionalProperties": true,
            "properties": {
                "design": { "$ref": "#/$defs/blockDesign" },
                "checkout": { "$ref": "#/$defs/blockCheckout" },
                "runtime": { "$ref": "#/$defs/blockRuntime" }
            }
        },
        "blockDesign": {
            "type": "object",
            "description": "Read by the designer's canvas and agreement drawer at design time.",
            "required": ["article"],
            "additionalProperties": true,
            "properties": {
                "article": {
                    "type": "string",
                    "minLength": 1,
                    "description": "Drawer grouping heading (free-form, never a closed list) — the contract-document section this clause reads under. The set of articles is whatever the registered clauses declare."
                },
                "scope": {
                    "enum": ["agreement", "assembly"],
                    "description": "What the clause binds. \"agreement\" (the default) = a term of ONE relationship, composed per-order in the drawer. \"assembly\" = a term of the COMPOSITION itself (a denomination pin, a dispute forum): composed ONCE at the assembly level of the designer, carried once in the assembly (identity-bearing — part of the compositionHash), and folded into EVERY agreement at checkout so every party signs it. Composing an assembly-scoped clause on an order — or an agreement-scoped one at assembly level — is a build/publish ERROR, never a silent no-op."
                },
                "nestsUnder": {
                    "type": ["string", "null"],
                    "description": "A field name on a parent clause this clause nests under in the drawer — a containment relationship read from the spec, never a hardcoded tree. Null for top-level clauses."
                },
                "fills": {
                    "type": "array",
                    "items": { "type": "string", "minLength": 1 },
                    "description": "The content fields (by name) the DESIGNER authors into the assembly — the tailoring that adapts a generic clause to a specific application (a pinned consent document, a pinned denomination). The drawer exposes field editors exactly for these; their values survive into the published assembly (identity-bearing — part of the compositionHash). Express as [] when the designer only selects the clause."
                },
                "composes": {
                    "type": ["object", "null"],
                    "description": "Composition binding — the on-network contract or external forum this clause composes with (the sixth noun). `interface` names a STANDARD composition interface (chain-agnostic, read from spec — never a bundled clause-id switch in code); the concrete instance ADDRESS is chain-specific and comes at runtime, not here. `forumUrl` deep-links a provider's own web UI for URL-only compositions (https: only — it renders as a link). Declared here (the designer composes it); dispatched at runtime. Null for clauses that compose with nothing.",
                    "required": ["interface"],
                    "properties": {
                        "interface": { "type": "string", "minLength": 1 },
                        "forumUrl": { "type": "string", "minLength": 1 }
                    }
                }
            }
        },
        "blockCheckout": {
            "type": "object",
            "description": "Read by the checkout fold: where declared values come from before the buyer signs. Any content field named in neither list — and not in design.fills — is the buyer's, authored at checkout (the default case; derived as the complement, never stored).",
            "additionalProperties": true,
            "properties": {
                "catalogueFills": {
                    "type": "array",
                    "items": { "type": "string", "minLength": 1 },
                    "description": "The content fields (by name) authored per-item on the member's CATALOG (item master data: freight class, hazmat class, cold-chain window) and folded onto the matching leaf at checkout. Generic surfaces render a spec-driven authoring section on the catalog item for ANY clause declaring this — including one this codebase has never seen. Express as [] when no field is catalog-authored."
                },
                "profileFills": {
                    "type": "array",
                    "items": { "type": "string", "minLength": 1 },
                    "description": "The content fields (by name) authored ONCE on the member's PROFILE (the member's master data: a dim-weight divisor, a declared credential id) and folded onto the matching leaf at checkout. The seller-level sibling of catalogueFills (catalog = what is sold, profile = who sells). Express as [] when no field is profile-authored."
                }
            }
        },
        "blockRuntime": {
            "type": "object",
            "description": "Read by the capability rail while the process runs.",
            "additionalProperties": true,
            "properties": {
                "interaction": {
                    "type": ["object", "null"],
                    "description": "The party↔party runtime interaction standard this clause's tasks use (e.g. a QR order-identity challenge at a hand-off, a per-order ECDH channel). `interface` names a STANDARD interaction, read from the spec — never a bundled clause-id switch. A frontend that registered a surface for the interface mounts it; one that didn't renders nothing extra — progressive enhancement, the protocol never depends on it. Null for clauses whose tasks need no dedicated interaction.",
                    "required": ["interface"],
                    "properties": {
                        "interface": { "type": "string", "minLength": 1 }
                    }
                },
                "fields": {
                    "type": "array",
                    "items": { "$ref": "#/$defs/field" },
                    "description": "Runtime-input field specs — values a party supplies at RUNTIME that are NOT committed content (e.g. a composed contract's opening parameters, paired with design.composes). Rendered by ONE generic form; the surface reads no interface name. Same field shape as content fields — one parser, one renderer. Express as [] when the clause takes no runtime input."
                }
            }
        }
    }
}
