{
    "clauseId": "figaro-content-handoff",
    "version": 1,
    "title": "Content hand-off",
    "description": "How the DIGITAL hand-off happens for this agreement's exchange \u2014 the twin of the physical hand-off clause, for value added in the digital medium (a production chain's cut, a design file, a dataset, an access credential; the freelancer's deliverable). Each bonded order with a digital deliverable carries its own content hand-off. Completion evidence is the delivered artifact's keccak256 content hash, filed as a runtime attestation at stage 1 and merkle-bound to the agreement \u2014 any counterparty verifies by rehashing what it received. Compose figaro-geolocation ALONGSIDE for territory/jurisdiction geofencing (a licensed territory, the jurisdiction of the work) \u2014 geofencing is that clause's concern, never fields here.",
    "fields": [
        {
            "name": "contentHandoff",
            "type": "array",
            "items": {
                "type": "enum",
                "values": [
                    "encrypted-transfer",
                    "repository-grant",
                    "public-release"
                ],
                "valueLabels": {
                    "encrypted-transfer": "Encrypted transfer",
                    "repository-grant": "Repository grant",
                    "public-release": "Public release"
                }
            },
            "minItems": 1,
            "required": true,
            "description": "How the digital exchange happens. encrypted-transfer = the artifact (or its decryption key) travels the per-order ECDH channel, counterparty-private; repository-grant = the counterparty is granted access at a named repository or platform; public-release = openly published, verified by content hash alone. At least one must be set when this clause is included in an agreement."
        }
    ],
    "stages": {
        "1": [
            {
                "name": "contentHash",
                "type": "string",
                "required": true,
                "pattern": "^0x[0-9a-fA-F]{64}$",
                "label": "Delivered content hash",
                "description": "keccak256 of the delivered artifact's bytes \u2014 the completion evidence. A counterparty verifies by rehashing what it received."
            },
            {
                "name": "contentUri",
                "type": "string",
                "required": false,
                "minLength": 0,
                "maxLength": 512,
                "label": "Content locator",
                "description": "Optional network locator for the delivered artifact (e.g. ipfs://\u2026) \u2014 for public-release and repository-grant modes; omit for counterparty-private transfers."
            }
        ]
    },
    "block": {
        "design": {
            "article": "logistics",
            "scope": "agreement",
            "nestsUnder": null,
            "fills": [],
            "composes": null
        },
        "checkout": {
            "catalogueFills": [],
            "profileFills": []
        },
        "runtime": {
            "interaction": {
                "interface": "ecdh-content"
            },
            "fields": []
        }
    }
}
