{
    "clauseId": "figaro-data-license",
    "version": 1,
    "title": "Data license",
    "description": "The terms of a DATA SALE \u2014 a bonded order whose value-added IS access to data (a dataset, a stream, the books behind resolved processes). Composes alongside figaro-commerce (the sale itself) and figaro-content-handoff (the delivery \u2014 encrypted-transfer for counterparty-private data). The license terms are WRITTEN ON THE CATALOG (checkout.catalogueFills): the seller writes them on the data item \u2014 the catalogue item whose dataSold names the data being sold \u2014 and checkout folds them into the agreement both parties sign; the offer toggle, whitelist, and calendar stay profile concerns (the disclosure policy), and price stays the item's own price field, never a field here. Licensed data is self-authenticating when sourceProcesses is set and every source named has resolved: each disclosed leaf travels with its merkle inclusion proof against that process's on-chain checkoutHash, so the licensee verifies provenance against the chain rather than the licensor's word; a source still open could take attestations after the sale commits, so the buyer reads each source's resolution on-chain before it signs. Data cannot be inspected before purchase without being given away; the seller's 2\u00d7 bond makes its promise about the data good before the trade, which is what makes pricing data possible without first revealing it. Redistribution cannot be prevented on-chain; the term creates timestamped, co-signed EVIDENCE for the outer recourse layers (co-seller pressure, arbitration forums, ordinary courts), the same posture as every off-chain obligation. The sustainable product is the stream, not the snapshot: a stream licensee who breaches loses the continuing stream. Compose figaro-schedule alongside for time-bounded access windows and figaro-geolocation for territory \u2014 those are their clauses' concerns, never fields here.",
    "fields": [
        {
            "name": "licenseScope",
            "type": "string",
            "required": true,
            "minLength": 1,
            "maxLength": 512,
            "description": "What is licensed, named editorially \u2014 the dataset, stream, or record family this sale grants access to. The invoice-legible name of the data product."
        },
        {
            "name": "purpose",
            "type": "string",
            "required": false,
            "minLength": 0,
            "maxLength": 512,
            "description": "The permitted use, stated as a restriction the licensee co-signs (e.g. internal analytics only, model training excluded). Omit for unrestricted use within the redistribution term."
        },
        {
            "name": "access",
            "type": "enum",
            "required": true,
            "values": [
                "snapshot",
                "stream"
            ],
            "valueLabels": {
                "snapshot": "Snapshot \u2014 the records as of delivery",
                "stream": "Stream \u2014 continuing access"
            },
            "description": "snapshot = a one-time delivery of the records as they stand, verified by content hash; stream = continuing access to the growing record, the repeated-game form \u2014 each period's delivery is a further bonded order or hand-off under this same agreement's terms."
        },
        {
            "name": "redistribution",
            "type": "enum",
            "required": true,
            "values": [
                "prohibited",
                "permitted"
            ],
            "valueLabels": {
                "prohibited": "No redistribution",
                "permitted": "Redistribution permitted"
            },
            "description": "Whether the licensee may pass the records onward. prohibited is an off-chain obligation: the chain cannot prevent copying, but this co-signed term is the timestamped evidence an outside forum reads."
        },
        {
            "name": "sourceProcesses",
            "type": "array",
            "required": false,
            "minItems": 0,
            "items": {
                "type": "string",
                "format": "bytes32-hex",
                "name": "processId",
                "required": true
            },
            "description": "The resolved processes whose data is licensed \u2014 provenance anchors. Each disclosed leaf verifies by merkle inclusion proof against the named process's on-chain checkoutHash. Omit for data products not anchored to specific processes."
        }
    ],
    "stages": {},
    "block": {
        "design": {
            "article": "data",
            "scope": "agreement",
            "nestsUnder": null,
            "fills": [],
            "composes": null
        },
        "checkout": {
            "catalogueFills": [
                "licenseScope",
                "purpose",
                "access",
                "redistribution",
                "sourceProcesses"
            ],
            "profileFills": []
        },
        "runtime": {
            "interaction": null,
            "fields": []
        }
    }
}
