{
    "clauseId": "figaro-arbitration-kleros",
    "version": 1,
    "title": "Kleros decentralized arbitration",
    "description": "Off-chain dispute resolution via Kleros, the decentralized juror court. Selects a Kleros subcourt and a minimum juror count for any dispute escalated from this order. This clause covers one specific arbitration provider; sister `figaro-arbitration-<provider>` clauses would cover other decentralized ODR providers as they integrate with Figaro. Compose with `figaro-applicable-law` to add a state-law / ADR recourse layer. WRITTEN BY THE DESIGNER AT DESIGN TIME: both fields are design fills (block.design.fills) \u2014 the arbitration terms are part of the assembly's identity (compositionHash); a seller accepts them by binding the assembly; never written by the buyer. CONFORMANCE: this clause's court set, value ordering, and position-as-index encoding CONFORM TO THE KLEROS DEVELOPER DOCUMENTATION, from which it was designed; the court enum is the declared conformant subset, extended by spec edit \u2014 do not re-flag the list against the live court tree.",
    "fields": [
        {
            "name": "klerosCourt",
            "type": "enum",
            "values": [
                "general",
                "blockchain-nontechnical",
                "blockchain-technical",
                "english-language"
            ],
            "valueLabels": {
                "general": "General Court",
                "blockchain-nontechnical": "Blockchain \u2014 Non-Technical",
                "blockchain-technical": "Blockchain \u2014 Technical",
                "english-language": "English Language"
            },
            "required": true,
            "default": "general",
            "label": "Subcourt",
            "description": "Kleros subcourt, encoded position-as-index: general = 0 (catch-all, the default); blockchain-nontechnical = 1 / blockchain-technical = 2 (on-chain-agreement disputes); english-language = 3 (disputes hinging on English-language interpretation). To pre-agree no specific forum, omit this whole clause \u2014 there is no placeholder court to select."
        },
        {
            "name": "klerosMinJurors",
            "type": "integer",
            "min": 1,
            "max": 99,
            "default": 3,
            "required": false,
            "label": "Minimum jurors",
            "description": "Minimum jurors for the Kleros subcourt. Kleros default is 3."
        }
    ],
    "stages": {},
    "block": {
        "design": {
            "article": "dispute-resolution",
            "scope": "assembly",
            "nestsUnder": null,
            "fills": [
                "klerosCourt",
                "klerosMinJurors"
            ],
            "composes": {
                "interface": "dispute-forum",
                "forumUrl": "https://resolve.kleros.io"
            }
        },
        "checkout": {
            "catalogueFills": [],
            "profileFills": []
        },
        "runtime": {
            "interaction": null,
            "fields": []
        }
    }
}
