{
    "clauseId": "figaro-handoff",
    "version": 1,
    "title": "Hand-off point",
    "description": "Where the physical hand-off happens for this agreement's exchange. Each bonded order with a physical exchange carries its own hand-off (the merchant\u2192courier pickup, the courier\u2192buyer drop-off, the on-site counter). The proximity-verification policy (figaro-proximity-policy) nests under this hand-off \u2014 the bands that certify the exchange.",
    "fields": [
        {
            "name": "handoff",
            "type": "array",
            "items": {
                "type": "enum",
                "values": [
                    "face-to-face",
                    "dead-drop",
                    "parking-area",
                    "locker"
                ],
                "valueLabels": {
                    "face-to-face": "Face to face",
                    "dead-drop": "Dead drop",
                    "parking-area": "Parking area",
                    "locker": "Locker"
                }
            },
            "minItems": 1,
            "required": true,
            "description": "Where the physical exchange happens. face-to-face = in person; dead-drop = left at an agreed spot; parking-area = curbside/lot; locker = a parcel locker. At least one must be set when this clause is included in an agreement."
        }
    ],
    "stages": {},
    "block": {
        "design": {
            "article": "logistics",
            "scope": "agreement",
            "nestsUnder": null,
            "fills": [],
            "composes": null
        },
        "checkout": {
            "catalogueFills": [],
            "profileFills": []
        },
        "runtime": {
            "interaction": {
                "interface": "qr-challenge"
            },
            "fields": []
        }
    }
}
